{"$schema":"https://json-schema.org/draft/2020-12/schema","$id":"https://foa-sdk.local/schemas/interchange/v1/manifest.tginterchange.schema.json","title":"FOA-SDK Canonical Interchange Manifest Schema 1","description":"Closed structural contract for foa-interchange-schema-v1. Canonical byte order, sorting, semantic fingerprints, and migration outcomes are defined by the Gate 5 C++ contract and companion documents.","type":"object","properties":{"schema_version":{"const":1},"schema_profile":{"const":"foa-interchange-schema-v1"},"canonical_profile":{"const":"foa-interchange-canonical-json-v1"},"package_kind":{"$ref":"#/$defs/packageKind"},"package_id":{"$ref":"#/$defs/semanticId"},"pack_id":{"$ref":"#/$defs/semanticId"},"display_name":{"$ref":"#/$defs/nonEmptyPresentation"},"producer":{"$ref":"#/$defs/producer"},"intended_consumers":{"type":"array","items":{"$ref":"#/$defs/consumer"},"minItems":0,"maxItems":64},"toolchain_lock":{"$ref":"#/$defs/toolchainLock"},"spatial_basis":{"$ref":"#/$defs/spatialBasis"},"temporal_basis":{"$ref":"#/$defs/temporalBasis"},"documents":{"type":"array","items":{"$ref":"#/$defs/document"},"minItems":0,"maxItems":4096},"assets":{"type":"array","items":{"$ref":"#/$defs/asset"},"minItems":0,"maxItems":4096},"identity_mappings":{"type":"array","items":{"$ref":"#/$defs/identityMapping"},"minItems":0,"maxItems":8192},"bindings":{"type":"array","items":{"$ref":"#/$defs/binding"},"minItems":0,"maxItems":16384},"payloads":{"type":"array","items":{"$ref":"#/$defs/payload"},"minItems":0,"maxItems":8192},"transformations":{"type":"array","items":{"$ref":"#/$defs/transformation"},"minItems":0,"maxItems":16384},"losses":{"type":"array","items":{"$ref":"#/$defs/loss"},"minItems":0,"maxItems":16384},"provenance":{"type":"array","items":{"$ref":"#/$defs/provenance"},"minItems":0,"maxItems":8192},"licensing":{"type":"array","items":{"$ref":"#/$defs/licensing"},"minItems":0,"maxItems":8192},"evidence_refs":{"type":"array","items":{"$ref":"#/$defs/evidence"},"minItems":0,"maxItems":8192},"extensions":{"type":"array","items":{"$ref":"#/$defs/extension"},"minItems":0,"maxItems":64}},"required":["schema_version","schema_profile","canonical_profile","package_kind","package_id","pack_id","producer","intended_consumers","toolchain_lock","spatial_basis","temporal_basis","documents","assets","identity_mappings","bindings","payloads","transformations","losses","provenance","licensing","evidence_refs","extensions"],"additionalProperties":false,"$defs":{"semanticId":{"type":"string","minLength":3,"maxLength":128,"pattern":"^[a-z][a-z0-9]*(?:[._-][a-z0-9]+)+$","x-foa-format":"semantic-id-v1","x-foa-byte-max":128},"optionalSemanticId":{"type":"string","maxLength":128,"pattern":"^(?:|[a-z][a-z0-9]*(?:[._-][a-z0-9]+)+)$","x-foa-format":"optional-semantic-id-v1","x-foa-byte-max":128},"versionToken":{"type":"string","minLength":1,"maxLength":128,"pattern":"^[a-z0-9._-]+$","x-foa-format":"version-token-v1","x-foa-byte-max":128},"optionalVersionToken":{"type":"string","maxLength":128,"pattern":"^[a-z0-9._-]*$","x-foa-format":"optional-version-token-v1","x-foa-byte-max":128},"sha256":{"type":"string","pattern":"^[0-9a-f]{64}$","x-foa-format":"sha256-v1"},"optionalSha256":{"type":"string","pattern":"^(?:|[0-9a-f]{64})$","x-foa-format":"optional-sha256-v1"},"presentation":{"type":"string","maxLength":4096,"x-foa-byte-max":4096},"nonEmptyPresentation":{"type":"string","minLength":1,"maxLength":4096,"x-foa-byte-max":4096},"sourceIdentity":{"type":"string","minLength":1,"maxLength":2048,"x-foa-byte-max":2048},"relativePath":{"type":"string","minLength":1,"maxLength":512,"pattern":"^(?!/)(?!.*\\\\)(?!.*:)(?!.*//)(?!.*(?:^|/)\\.{1,2}(?:/|$))(?!.*[. ](?:/|$))[\\x20-\\x7e]{1,512}$","x-foa-format":"relative-package-path-v1","x-foa-byte-max":512},"extensionCanonicalJson":{"type":"string","maxLength":1048576,"x-foa-byte-max":1048576},"packageKind":{"type":"string","enum":["authoring-interchange"]},"hostKind":{"type":"string","enum":["o3de","blender","unity-editor","host-neutral"]},"bindingState":{"type":"string","enum":["unresolved","active","stale","conflicted","superseded","retired"]},"mappingOperation":{"type":"string","enum":["rename","move","duplicate","fork","replace","merge","split","aggregate","tombstone"]},"mappingCompleteness":{"type":"string","enum":["incomplete","complete"]},"payloadRole":{"type":"string","enum":["canonical-document","scene-source","mesh-source","texture-source","material-map","skeleton-source","animation-source","collider-source","metadata","preview","licence-notice"]},"transformationPhase":{"type":"string","enum":["authoring","export","import","normalization","reverse-export","migration"]},"reversibility":{"type":"string","enum":["reversible","conditionally-reversible","irreversible","unknown"]},"lossSeverity":{"type":"string","enum":["information","warning","error","blocker"]},"sourceKind":{"type":"string","enum":["project-owned","synthetic","user-supplied-reviewed","user-supplied-unreviewed","local-reference-only","upstream-reference","prohibited"]},"redistributionState":{"type":"string","enum":["allowed","local-only","review-required","blocked"]},"parameterKind":{"type":"string","enum":["boolean","signed-integer","unsigned-integer","number","string","matrix4x4","rational-rate"]},"spatialBasis":{"type":"object","properties":{"handedness":{"const":"right-handed"},"right_axis":{"const":"+x"},"forward_axis":{"const":"+y"},"up_axis":{"const":"+z"},"linear_unit":{"const":"metre"},"angular_unit":{"const":"radian"},"vector_convention":{"const":"column-vector"},"multiplication_convention":{"const":"matrix-on-left"},"storage_order":{"const":"column-major"}},"required":["handedness","right_axis","forward_axis","up_axis","linear_unit","angular_unit","vector_convention","multiplication_convention","storage_order"],"additionalProperties":false},"temporalBasis":{"type":"object","properties":{"time_unit":{"const":"second"}},"required":["time_unit"],"additionalProperties":false},"matrix4x4":{"type":"object","properties":{"column_major_values":{"type":"array","items":{"type":"number"},"minItems":16,"maxItems":16},"mapping_direction":{"$ref":"#/$defs/presentation"}},"required":["column_major_values","mapping_direction"],"additionalProperties":false},"rationalRate":{"type":"object","properties":{"numerator":{"type":"integer","minimum":0},"denominator":{"type":"integer","minimum":1}},"required":["numerator","denominator"],"additionalProperties":false},"tolerance":{"type":"object","properties":{"subject_property_path":{"$ref":"#/$defs/nonEmptyPresentation"},"absolute":{"type":"number","minimum":0},"relative":{"type":"number","minimum":0},"angular_radians":{"type":"number","minimum":0},"comparison_norm":{"$ref":"#/$defs/nonEmptyPresentation"},"unit":{"$ref":"#/$defs/nonEmptyPresentation"},"scope":{"$ref":"#/$defs/nonEmptyPresentation"}},"required":["subject_property_path","absolute","relative","angular_radians","comparison_norm","unit","scope"],"additionalProperties":false},"producer":{"type":"object","properties":{"host_kind":{"$ref":"#/$defs/hostKind"},"application_id":{"$ref":"#/$defs/presentation"},"application_version":{"$ref":"#/$defs/optionalVersionToken"},"provider_id":{"$ref":"#/$defs/presentation"},"provider_version":{"$ref":"#/$defs/optionalVersionToken"},"extension_id":{"$ref":"#/$defs/presentation"},"extension_version":{"$ref":"#/$defs/optionalVersionToken"},"extension_revision":{"$ref":"#/$defs/presentation"},"extension_digest":{"$ref":"#/$defs/optionalSha256"},"configuration_fingerprint":{"$ref":"#/$defs/optionalSha256"},"workspace_id_observation":{"$ref":"#/$defs/presentation"},"profile_id_observation":{"$ref":"#/$defs/presentation"}},"required":["host_kind","application_id","application_version","provider_id","provider_version","extension_id","extension_version","extension_revision","extension_digest","configuration_fingerprint","workspace_id_observation","profile_id_observation"],"additionalProperties":false},"consumer":{"type":"object","properties":{"host_kind":{"$ref":"#/$defs/hostKind"},"consumer_id":{"$ref":"#/$defs/semanticId"},"consumer_version":{"$ref":"#/$defs/versionToken"},"profile_id":{"$ref":"#/$defs/semanticId"},"required":{"type":"boolean"}},"required":["host_kind","consumer_id","consumer_version","profile_id","required"],"additionalProperties":false},"toolchainComponent":{"type":"object","properties":{"component_kind":{"$ref":"#/$defs/nonEmptyPresentation"},"component_id":{"$ref":"#/$defs/semanticId"},"version":{"$ref":"#/$defs/versionToken"},"revision":{"$ref":"#/$defs/nonEmptyPresentation"},"digest":{"$ref":"#/$defs/sha256"}},"required":["component_kind","component_id","version","revision","digest"],"additionalProperties":false},"toolchainLock":{"type":"object","properties":{"foa_sdk_commit":{"$ref":"#/$defs/nonEmptyPresentation"},"schema_profile":{"const":"foa-interchange-schema-v1"},"configuration_fingerprint":{"$ref":"#/$defs/sha256"},"fixture_revision":{"$ref":"#/$defs/nonEmptyPresentation"},"components":{"type":"array","items":{"$ref":"#/$defs/toolchainComponent"},"minItems":1,"maxItems":128}},"required":["foa_sdk_commit","schema_profile","configuration_fingerprint","fixture_revision","components"],"additionalProperties":false},"document":{"type":"object","properties":{"document_id":{"$ref":"#/$defs/semanticId"},"document_kind":{"$ref":"#/$defs/nonEmptyPresentation"},"document_schema_id":{"$ref":"#/$defs/semanticId"},"document_schema_version":{"type":"integer","minimum":1},"payload_id":{"$ref":"#/$defs/semanticId"},"revision_fingerprint":{"$ref":"#/$defs/sha256"},"subject_refs":{"type":"array","items":{"$ref":"#/$defs/presentation"},"minItems":0,"maxItems":256},"asset_ids":{"type":"array","items":{"$ref":"#/$defs/semanticId"},"minItems":0,"maxItems":256},"provenance_ids":{"type":"array","items":{"$ref":"#/$defs/semanticId"},"minItems":0,"maxItems":256},"licensing_ids":{"type":"array","items":{"$ref":"#/$defs/semanticId"},"minItems":0,"maxItems":256}},"required":["document_id","document_kind","document_schema_id","document_schema_version","payload_id","revision_fingerprint","subject_refs","asset_ids","provenance_ids","licensing_ids"],"additionalProperties":false},"asset":{"type":"object","properties":{"asset_id":{"$ref":"#/$defs/semanticId"},"asset_kind":{"$ref":"#/$defs/nonEmptyPresentation"},"revision_fingerprint":{"$ref":"#/$defs/sha256"},"payload_ids":{"type":"array","items":{"$ref":"#/$defs/semanticId"},"minItems":0,"maxItems":256},"document_ids":{"type":"array","items":{"$ref":"#/$defs/semanticId"},"minItems":0,"maxItems":256},"subject_refs":{"type":"array","items":{"$ref":"#/$defs/presentation"},"minItems":0,"maxItems":256},"provenance_ids":{"type":"array","items":{"$ref":"#/$defs/semanticId"},"minItems":0,"maxItems":256},"licensing_ids":{"type":"array","items":{"$ref":"#/$defs/semanticId"},"minItems":0,"maxItems":256}},"required":["asset_id","asset_kind","revision_fingerprint","payload_ids","document_ids","subject_refs","provenance_ids","licensing_ids"],"additionalProperties":false},"identityMapping":{"type":"object","properties":{"mapping_id":{"$ref":"#/$defs/semanticId"},"operation":{"$ref":"#/$defs/mappingOperation"},"source_asset_ids":{"type":"array","items":{"$ref":"#/$defs/semanticId"},"minItems":0,"maxItems":256},"target_asset_ids":{"type":"array","items":{"$ref":"#/$defs/semanticId"},"minItems":0,"maxItems":256},"source_revisions":{"type":"array","items":{"$ref":"#/$defs/sha256"},"minItems":0,"maxItems":256},"target_revisions":{"type":"array","items":{"$ref":"#/$defs/sha256"},"minItems":0,"maxItems":256},"transformation_ids":{"type":"array","items":{"$ref":"#/$defs/semanticId"},"minItems":0,"maxItems":256},"loss_ids":{"type":"array","items":{"$ref":"#/$defs/semanticId"},"minItems":0,"maxItems":256},"provenance_ids":{"type":"array","items":{"$ref":"#/$defs/semanticId"},"minItems":0,"maxItems":256},"evidence_ref_ids":{"type":"array","items":{"$ref":"#/$defs/semanticId"},"minItems":0,"maxItems":256},"completeness":{"$ref":"#/$defs/mappingCompleteness"}},"required":["mapping_id","operation","source_asset_ids","target_asset_ids","source_revisions","target_revisions","transformation_ids","loss_ids","provenance_ids","evidence_ref_ids","completeness"],"additionalProperties":false},"binding":{"type":"object","properties":{"binding_id":{"$ref":"#/$defs/semanticId"},"subject_id":{"$ref":"#/$defs/nonEmptyPresentation"},"host_kind":{"$ref":"#/$defs/hostKind"},"consumer_profile":{"$ref":"#/$defs/nonEmptyPresentation"},"native_id_kind":{"$ref":"#/$defs/nonEmptyPresentation"},"native_id_value":{"$ref":"#/$defs/nonEmptyPresentation"},"native_path_observation":{"$ref":"#/$defs/presentation"},"state":{"$ref":"#/$defs/bindingState"},"supersedes_binding_id":{"$ref":"#/$defs/optionalSemanticId"},"required":{"type":"boolean"}},"required":["binding_id","subject_id","host_kind","consumer_profile","native_id_kind","native_id_value","native_path_observation","state","supersedes_binding_id","required"],"additionalProperties":false},"payload":{"type":"object","properties":{"payload_id":{"$ref":"#/$defs/semanticId"},"relative_path":{"$ref":"#/$defs/relativePath"},"role":{"$ref":"#/$defs/payloadRole"},"media_type":{"$ref":"#/$defs/nonEmptyPresentation"},"byte_size":{"type":"integer","minimum":0,"maximum":17179869184},"digest":{"$ref":"#/$defs/sha256"},"dependency_ids":{"type":"array","items":{"$ref":"#/$defs/semanticId"},"minItems":0,"maxItems":256},"subject_ids":{"type":"array","items":{"$ref":"#/$defs/presentation"},"minItems":0,"maxItems":256},"provenance_ids":{"type":"array","items":{"$ref":"#/$defs/semanticId"},"minItems":0,"maxItems":256},"licensing_ids":{"type":"array","items":{"$ref":"#/$defs/semanticId"},"minItems":0,"maxItems":256}},"required":["payload_id","relative_path","role","media_type","byte_size","digest","dependency_ids","subject_ids","provenance_ids","licensing_ids"],"additionalProperties":false},"parameter":{"type":"object","properties":{"name":{"$ref":"#/$defs/nonEmptyPresentation"},"kind":{"$ref":"#/$defs/parameterKind"},"boolean_value":{"type":"boolean"},"signed_value":{"type":"integer"},"unsigned_value":{"type":"integer","minimum":0},"number_value":{"type":"number"},"string_value":{"$ref":"#/$defs/presentation"},"matrix_value":{"$ref":"#/$defs/matrix4x4"},"rate_value":{"$ref":"#/$defs/rationalRate"}},"required":["name","kind","boolean_value","signed_value","unsigned_value","number_value","string_value","matrix_value","rate_value"],"additionalProperties":false},"transformation":{"type":"object","properties":{"transformation_id":{"$ref":"#/$defs/semanticId"},"sequence":{"type":"integer","minimum":0},"phase":{"$ref":"#/$defs/transformationPhase"},"operation_code":{"$ref":"#/$defs/nonEmptyPresentation"},"subject_ids":{"type":"array","items":{"$ref":"#/$defs/presentation"},"minItems":0,"maxItems":256},"property_paths":{"type":"array","items":{"$ref":"#/$defs/presentation"},"minItems":0,"maxItems":256},"source_basis_or_profile":{"$ref":"#/$defs/presentation"},"destination_basis_or_profile":{"$ref":"#/$defs/presentation"},"parameters":{"type":"array","items":{"$ref":"#/$defs/parameter"},"minItems":0,"maxItems":256},"reversibility":{"$ref":"#/$defs/reversibility"},"tolerances":{"type":"array","items":{"$ref":"#/$defs/tolerance"},"minItems":0,"maxItems":256},"evidence_ref_ids":{"type":"array","items":{"$ref":"#/$defs/semanticId"},"minItems":0,"maxItems":256}},"required":["transformation_id","sequence","phase","operation_code","subject_ids","property_paths","source_basis_or_profile","destination_basis_or_profile","parameters","reversibility","tolerances","evidence_ref_ids"],"additionalProperties":false},"loss":{"type":"object","properties":{"loss_id":{"$ref":"#/$defs/semanticId"},"sequence":{"type":"integer","minimum":0},"subject_id":{"$ref":"#/$defs/nonEmptyPresentation"},"property_path":{"$ref":"#/$defs/presentation"},"source_profile":{"$ref":"#/$defs/presentation"},"destination_profile":{"$ref":"#/$defs/presentation"},"phase":{"$ref":"#/$defs/transformationPhase"},"reason_code":{"$ref":"#/$defs/nonEmptyPresentation"},"severity":{"$ref":"#/$defs/lossSeverity"},"source_feature":{"$ref":"#/$defs/presentation"},"result_representation":{"$ref":"#/$defs/nonEmptyPresentation"},"reversibility":{"$ref":"#/$defs/reversibility"},"tolerances":{"type":"array","items":{"$ref":"#/$defs/tolerance"},"minItems":0,"maxItems":256},"evidence_ref_ids":{"type":"array","items":{"$ref":"#/$defs/semanticId"},"minItems":0,"maxItems":256}},"required":["loss_id","sequence","subject_id","property_path","source_profile","destination_profile","phase","reason_code","severity","source_feature","result_representation","reversibility","tolerances","evidence_ref_ids"],"additionalProperties":false},"provenance":{"type":"object","properties":{"provenance_id":{"$ref":"#/$defs/semanticId"},"subject_id":{"$ref":"#/$defs/nonEmptyPresentation"},"source_kind":{"$ref":"#/$defs/sourceKind"},"source_identity":{"$ref":"#/$defs/sourceIdentity"},"source_revision":{"$ref":"#/$defs/nonEmptyPresentation"},"source_digest":{"$ref":"#/$defs/sha256"},"authorship":{"$ref":"#/$defs/nonEmptyPresentation"},"modification_state":{"$ref":"#/$defs/nonEmptyPresentation"},"attribution":{"$ref":"#/$defs/presentation"},"permitted_use":{"$ref":"#/$defs/nonEmptyPresentation"},"evidence_ref_ids":{"type":"array","items":{"$ref":"#/$defs/semanticId"},"minItems":0,"maxItems":256}},"required":["provenance_id","subject_id","source_kind","source_identity","source_revision","source_digest","authorship","modification_state","attribution","permitted_use","evidence_ref_ids"],"additionalProperties":false},"licensing":{"type":"object","properties":{"licensing_id":{"$ref":"#/$defs/semanticId"},"subject_id":{"$ref":"#/$defs/nonEmptyPresentation"},"spdx_expression_or_license_ref":{"$ref":"#/$defs/nonEmptyPresentation"},"redistribution_state":{"$ref":"#/$defs/redistributionState"},"required_notices":{"type":"array","items":{"$ref":"#/$defs/presentation"},"minItems":0,"maxItems":256},"reviewer":{"$ref":"#/$defs/presentation"},"decision_at_utc":{"$ref":"#/$defs/presentation"},"evidence_ref_ids":{"type":"array","items":{"$ref":"#/$defs/semanticId"},"minItems":0,"maxItems":256}},"required":["licensing_id","subject_id","spdx_expression_or_license_ref","redistribution_state","required_notices","reviewer","decision_at_utc","evidence_ref_ids"],"additionalProperties":false},"evidence":{"type":"object","properties":{"evidence_ref_id":{"$ref":"#/$defs/semanticId"},"evidence_kind":{"$ref":"#/$defs/nonEmptyPresentation"},"subject_id":{"$ref":"#/$defs/nonEmptyPresentation"},"external_evidence_id":{"$ref":"#/$defs/nonEmptyPresentation"},"external_evidence_fingerprint":{"$ref":"#/$defs/sha256"}},"required":["evidence_ref_id","evidence_kind","subject_id","external_evidence_id","external_evidence_fingerprint"],"additionalProperties":false},"extension":{"type":"object","properties":{"namespace":{"$ref":"#/$defs/semanticId"},"schema_version":{"type":"integer","minimum":1},"canonical_json":{"$ref":"#/$defs/extensionCanonicalJson"},"digest":{"$ref":"#/$defs/sha256"}},"required":["namespace","schema_version","canonical_json","digest"],"additionalProperties":false}}}