{"schema_version":1,"schema_profile":"foa-interchange-schema-v1","canonical_profile":"foa-interchange-canonical-json-v1","package_kind":"authoring-interchange","package_id":"example.documents","pack_id":"example.documents-pack","producer":{"host_kind":"host-neutral","application_id":"foa.synthetic","application_version":"v1","provider_id":"","provider_version":"","extension_id":"","extension_version":"","extension_revision":"","extension_digest":"","configuration_fingerprint":"1111111111111111111111111111111111111111111111111111111111111111","workspace_id_observation":"","profile_id_observation":""},"intended_consumers":[],"toolchain_lock":{"foa_sdk_commit":"9f8b8c6dfd842ac27b6cd68c0e55272ae753fdd3","schema_profile":"foa-interchange-schema-v1","configuration_fingerprint":"1111111111111111111111111111111111111111111111111111111111111111","fixture_revision":"schema-v1-public-example","components":[{"component_kind":"sdk","component_id":"foa.sdk","version":"v1","revision":"9f8b8c6dfd842ac27b6cd68c0e55272ae753fdd3","digest":"2222222222222222222222222222222222222222222222222222222222222222"}]},"spatial_basis":{"handedness":"right-handed","right_axis":"+x","forward_axis":"+y","up_axis":"+z","linear_unit":"metre","angular_unit":"radian","vector_convention":"column-vector","multiplication_convention":"matrix-on-left","storage_order":"column-major"},"temporal_basis":{"time_unit":"second"},"documents":[{"document_id":"document.example","document_kind":"example-document","document_schema_id":"foa.example-document","document_schema_version":1,"payload_id":"payload.document","revision_fingerprint":"b82118f293b6b5c49f5834b837c18d2432f8ce7a3907d9c3dfdb3f913eec1ed6","subject_refs":["subject.example"],"asset_ids":[],"provenance_ids":[],"licensing_ids":[]}],"assets":[],"identity_mappings":[],"bindings":[],"payloads":[{"payload_id":"payload.document","relative_path":"documents/example.json","role":"canonical-document","media_type":"application/json","byte_size":2,"digest":"44136fa355b3678a1146ad16f7e8649e94fb4fc21fe77e8310c060f61caaff8a","dependency_ids":[],"subject_ids":["subject.example"],"provenance_ids":[],"licensing_ids":[]}],"transformations":[],"losses":[],"provenance":[],"licensing":[],"evidence_refs":[],"extensions":[]}